,headline,url,date,speech_text
8,"
Statement by the President in the Verkhovna Rada during the consideration of the amendments to the Constitution regarding the course on Ukraine's membership in the EU and NATO
",https://www.president.gov.ua/en/news/vistup-prezidenta-u-verhovnij-radi-pid-chas-rozglyadu-zmin-d-51174,22 November 2018  - 18:38,"Dear Mr. Chairman!
Dear people’s deputies!
Fellow Ukrainians!
I have zero doubt that you will support the draft amendments to the Constitution in the first reading now. They, by force of the Basic Law, will oblige the Ukrainian authorities - any authorities and all its branches - to ensure Ukraine's accession to the European Union and NATO.
I do not see the arguments against the voting, do not understand them and do not accept them. And that's why. In four years we have overcome a huge distance on the path to European and Euro-Atlantic integration. As one of the European Commissioners said yesterday, Ukraine and the European Union have come closer than ever to each other - due to people who started the Revolution of Dignity five years ago. Let me add that no non-NATO member state has such close relations with the Alliance as Ukraine. This is also due to the people who started the Revolution of Dignity five years ago and who are sitting in this hall.
But if we take comparison with our neighbors as a basis, we are running extremely late and hang behind. Poland, Hungary and the Czech Republic joined NATO in March 1999, and in May 2004, they joined the European Union, together with Slovenia, Slovakia and the Baltic States. And at that moment we have not even knocked on the door of the two most successful international unions! And in the very same year, we have disrupted the plan to chain Ukraine to a single Russian economic space at the cost of tremendous efforts.
The post-colonial society for a long time remained in captivity of imperial stereotypes and illusions, which have been flooding  here with the Kremlin propaganda for decades. Including the myths about allegedly fraternal Russia and supposedly aggressive NATO bloc. The political elite of that time, instead of going ahead and leading people, played along with crass prejudices.
Yes, there were politicians who thought strategically, who looked ahead, who saw threats and sought responses to them. At the end of 2000s, we made an attempt to spur our accession to NATO. There are a lot of witnesses and even participants of those events in this hall.
Some opposed openly. They have been blocking the work of the Verkhovna Rada for months; spreading disinformation in the media; ""opposition"" to NATO has been proclaimed the cornerstone of their policy. In short, they acted in the interests of Russia as a classical fifth column and actually they are doing the same now.
Others, although squeezing out words and even signatures in support of integration into NATO, have been quietly putting spokes in wheel, sending signals to the West that now is not the time for the MAP yet.
The then-government did not speak of its position on NATO in one voice and we lost the chance to secure ourselves from Russian aggression.
“In a number of neighboring states ... there have been repeated attempts to expand NATO, including by the so-called accelerated accession to the alliance of Georgia and Ukraine. All this, of course, required a clear and well-coordinated work of all the special power structures, law enforcement agencies and a very high level of coordination of their activities. I have to say that the Federal Security Service has successfully completed its tasks in whole”.
This is a message from the website ""kremlin.ru"" dated January 29, 2009. These are the original words of the then-president of Russia at the expanded FSB-KGB board. I have no questions to Russians. But how do those Ukrainian politicians, who at the end of the 2000s freely or non-freely took part in the named special operation, feel today? Who torpedoed Ukraine's accession to NATO and left the country vulnerable to Russian invasion.
I am deeply convinced that if we had been a member of the Alliance, Russia would not have dared annex Crimea and invade Donbas. And I note that the Kremlin launched an aggression against Ukraine when Yanukovych's regime proclaimed our non-alignment status.
In 2014, we returned the provision on Euro-Atlantic integration to the law on the principles of foreign and domestic policy. This swing, when the fundamental law is amended by a simple majority of votes, should be broken. And we will do it with amendments to the Constitution - with today's vote. I am hopeful and I am confident that I should unite this hall despite the political confrontation taking place today in Ukraine. And in February, at the next session, we will adopt the amendments to the Constitution once for all.
This is an additional guarantee from the revenge of the pro-Russian, anti-NATO, anti-European forces. I do not want to exaggerate the threat of such a revenge, but I also urge not to ignore it and not to underestimate it.
We must guarantee the inevitability of the European and Euro-Atlantic course. It is our responsibility to present and future generations.
By fixing in the Constitution the obligatory course of joining NATO and the European Union, we send a powerful message about the seriousness and irreversibility of our intentions to our partners on both sides of the Atlantic Ocean. Last week, by the way, a meeting of the Ukraine-US Strategic Partnership Commission was held  in Washington pursuant to my agreement with US President Donald Trump. And in the final statement, the US once again stressed that Ukraine would be in NATO. And in the summer, this prospect was documented in the final resolution of the NATO Brussels Summit, which confirmed the decision adopted in 2008 in Bucharest: the Alliance's doors for Ukraine are open. Dot! And in the summer, this prospect was documented in the final resolution of the NATO Brussels Summit, during which I personally participated in the Ukraine-NATO and Georgia-NATO commission. And among the 19 speakers, all 19 heads of state and government firmly urged to provide an immediate prospect of membership for Ukraine and Georgia, and confirmed the decision adopted in 2008 in Bucharest: the Alliance's doors for Ukraine are open.
Yes, not everyone is delighted with our perseverance in the west and many look back at Moscow just as they used to. But can this stop us?
By fixing in the Constitution the obligatory course of joining NATO and the European Union, we send a message to Moscow: we break up permanently and irrevocably. Russia as an aggressor country does not have and will not have a veto on our accession either to NATO or to the European Union. This is the sovereign right of Ukraine as a country that is confidently going its own way.
 
The issues of the European Union and NATO are very closely linked. These two organizations have somewhat different goals, but common values. And the membership criteria that we still have to achieve are very similar. Accession to the EU and the North Atlantic Alliance is a very ambitious task and its implementation is so difficult that it would be wrong to promise specific terms. But every day the hard work of the diplomats, the military and the whole country brings us closer to this goal, because the united Europe is our promised land. The land protected by a security umbrella, because NATO is the most effective, strongest and most organized collective security and defense system. During almost seven decades of NATO's operation, no country has dared attack any, even the smallest member of the Alliance.
I have repeatedly told that we are not heading to NATO with empty hands. In recent years, we have created a strong, capable army, which has a colossal experience of reflecting Russian aggression. Glory to the Ukrainian Army! It will substantially strengthen the Alliance's eastern flank. It implements an ambitious program of transition from Soviet to NATO standards in all areas of military construction - through an unprecedented number of joint exercises, the implementation of annual national programs, the achievement of compatibility of the entire security and defense sector.
The fact that in the east we are defending not only ourselves, but also the whole European civilization greatly enhances our moral right to apply for membership in the European Union as a full-fledged member.
We are currently focusing on the implementation of the Association Agreement and the Free Trade Agreement. We see how the exports of Ukrainian products to the European Union is constantly increasing. Last year, it grew by 30 percent, and this year by another 16 percent. The structure of exports is being gradually changed. Two days ago, during my meeting with business, the EU representative Hugues Mingarelli emphasized that in 2013, the share of the EU had equalled 25%. Now, it is 42%. This is a clear position about whom can we trust. Russia expected the imposition of embargo to have a ruining effect. For today, we demonstrate that Ukraine has radically changed the vectors of its industry in 4 years, re-oriented its exports. Our cooperation and DCFTA with the EU have been fully justified. We move from the sale of raw materials to the sale of processed industrial and agricultural products with added value. European companies, due to the lack of customs barriers, began to move production to us and create new jobs here.
Apart from the fact that the Agreement is a way of implementing our civilized choice, reorienting the economy to European and other markets has helped us overcome the deep socio-economic crisis caused by the war and economic blackmail of Russia. Russia closed its market, which was traditional for the sale of Ukrainian goods, which once absorbed a third of our exports. It wanted to strangle us economically, but made us stronger and more confident in our civilizational choice.
The past years have been and still are the time of great trials. The country has gone through a deep economic crisis, the reasons of which I have just recalled, and the level of living standards is being restored too slowly. Some inevitable reforms were too painful, but we could not but start them, because the consequences of the lack of these reforms would be even more difficult. Because of Russia's assault, we lost thousands and thousands of human lives, soldiers and civilians. A deep wound from these losses remains open and does not heal. The promise of quickly finishing the war did not come true and I publicly apologized to everyone for that.
However, we became more powerful as a nation, more confident in our strength, more solid in our intentions. We have strengthened our unity and strengthened our faith in our European future. Today, we cement this faith and confidence in the Constitution.
Today's vote is not an accidental episode. This is part of our strategy that we have been consistently implementing over the past four and a half years. Only Ukraine's integration into the Euro-Atlantic area guarantees us peace and security, independence and poverty alleviation.
We will not retreat from this strategy. Ukraine, going its own way, will definitely become a full member of NATO and a full member of the European Union.
Neither me, nor you, nor the majority of Ukrainians doubt that.
Glory to Ukraine!"
9,"
Statement by the President of Ukraine regarding the decision of the Holy Synod of the Ecumenical Patriarchate
",https://www.president.gov.ua/en/news/zayava-prezidenta-ukrayini-u-zvyazku-iz-rishennyam-sinodu-vs-50346,11 October 2018  - 19:27,"Dear Ukrainians!
The Lord saw the struggle of the Ukrainian people for their independence. He heard our prayers. He properly estimated our labor. It became so desirable for Him to have His All-Holiness Ecumenical Patriarch Bartholomew and the Holy Synod of the Mother Church of Constantinople to declare the dreamed and long-awaited ""yes"", for which we fought for a long time.
There will be Autocephalous Orthodox Church of Ukraine.
The decision of the Ecumenical Patriarch and the Holy Synod has finally dispelled the imperial illusions and chauvinistic fantasies of Moscow, which were not supported by any legal church document - about Ukraine as so called ""canonical territory of the Russian Church"". It was in 1924 when the Ecumenical Patriarchate acknowledged the fact that the so-called ""transition"" of the Kyiv Metropolitan in the possession of Moscow took place ""not by the canonical rules"". And today the Holy Synod confirmed this position once again.
World Orthodoxy, as His All-Holiness Bartholomew once wrote, is a ""constellation of independent and equal national churches"". And finally, my dear friends, our Ukrainian star will shine in this constellation. The decision to grant Autocephaly has already been taken. I emphasize, that the decision to grant Autocephaly to Ukraine has been approved and confirmed once again.
By the work of God, their own Local Churches have been set up in all the Orthodox states that have won their independence. This happened in Bulgaria, in Greece, in Georgia, in Serbia, in Cyprus, in Romania, in Russia. Now our State of Ukraine is joining their ranks.
However, the question of Tomos and Autocephaly goes far beyond the church life, as the State has joined it. This is a matter of our independence. This is a matter of our national security. This is a matter of our statehood. This is a matter of the entire global geopolitics. This is the fall of the ""Third Rome"" as the most ancient conceptual claim of Moscow for the global domination.
Autocephaly is the part of our pro-European and pro-Ukrainian state strategy, which we have been consistently implementing over the past four years and, I emphasize, which we will implement hereafter. This is the foundation of our own path of development, the development of the State of Ukraine and the development of the Ukrainian nation.
Tomos is actually another Act of Declaration of Independence of Ukraine. The empire is losing one of the last levers of influence on its former colony.
For us, our own church is a guarantee of the spiritual freedom. This is the key to social harmony. I guarantee that the State of Ukraine will respect the choice of those who decide to remain in the church structure, which will maintain its unity with the Russian Orthodox Church. But I also guarantee that the state will protect the rights of those priests and believers of the Ukrainian Orthodox Church of the Moscow Patriarchate, who voluntarily decide to leave the influence of Moscow to establish, along with the others, the Autocephalous Ukrainian Orthodox Church.
Today I can already say that the appeal to the Ecumenical Patriarch with the request to provide Autocephaly was supported by a group of Bishops of the Ukrainian Orthodox Church of the Moscow Patriarchate. They endured pressure, blackmail, threats and intimidation, yet they appealed with their signatures to the Ecumenical Patriarch. And this is worth acknowledgment.
I am grateful to Patriarch Filaret and all the Hierarchs of the Ukrainian Orthodox Church of Kyiv Patriarchate, Metropolitan Macariy and the Bishops of the Ukrainian Autocephalous Orthodox Church for the spirit of unity which they demonstrated, and for their unanimous appeal to the Ecumenical Patriarch. I congratulate both Leaders on the fact that finally all the Moscow charges on them have been lifted. They have been recognized as the Canonical Bishops.
I want to express my special gratitude to the Verkhovna Rada of Ukraine, which supported my appeal to the Ecumenical Patriarch concerning the establishment of the Autocephalous Orthodox Church and the provision of Autocephaly to the Ukrainian Church with the abundance of votes.
I want to thank every participant of the Procession on July 28, and all Ukrainians who strive for the Autocephalous Church and pray for it.
All together, we bow down to His All-Holiness Bartholomew for his care for Ukraine.
Your All-Holiness, Ukraine is looking forward to your pastoral visit to the people, which was baptized during the time of the Great Prince Vladimir.
Today we received the Autocephaly, and after the Council, the Primate of the Ukrainian Local Orthodox Church will obtain Tomos.
The Ukrainian government guarantees the full respect for religious freedom for the believers of all denominations. There is no state church, we never had it and there will never be one. And nobody will be ""invited by force"" to the Orthodox Church consecrated with Tomos.
Once again I emphasize that this is a matter of free choice for each believer.
The joint creation of an independent church cannot be the basis for discord, for confrontation, for violence. We certainly can't let it happen. On the opposite side, it is a road to peace, comfort and understanding.
As soon as you see people who will call up to take the Laurel, monastery or temple by force, you should know - they are the agents of Moscow. As the goal of the Kremlin is to fuel the religious war in Ukraine. And this is definitely not my plan, not the plan of the Ukrainian people and not the plan of the State of Ukraine.
Dear Ukrainians!
I sincerely congratulate you on this very grand historical event, and I am very grateful for the massive support of the idea that came about.
This is a great victory of the God-loving Ukrainian people over the Moscow demons, the victory of Good over Evil, the victory of Light over Darkness.
I congratulate everyone on this great day, for which the Ukrainian people have been waiting for 332 long years.
I congratulate you!
Glory to Ukraine!"
