,headline,url,date,speech_text
3,"
Address  of President of Ukraine  at the Traditional meeting with heads of diplomatic representation of foreign states and international organizations accredited in Ukraine  
",https://www.president.gov.ua/en/news/vistup-prezidenta-na-shorichnij-zustrichi-z-glavami-diplomat-52522,16 January 2019  - 21:35,"Your Excellences,
Dear Mr. Speaker, Mr. Prime Minister,
Your Beatitude, 
Ladies and Gentlemen,
Dear friends,
Please accept my sincere congratulations on the New Year!
May this year bring us what all people on our planet strive for the most, and what we, Ukrainians, pray for five years already – peace.
Only those who have experienced the war understand the true value of peace.
However, peace is not only about the absence of war.
Peace is about freedom. It is about being a master on your own land.
It is also about the right to freely choose and determine your own future.
That is why for us peace and freedom are undivided.
For us, Ukrainians, these values are not abstract, but very special ones.
We know for sure what we fight for.
This is where our strength resides. Contrary to those who want to deprive us from our freedom and peace.
 
Your Excellencies,
The future of the world order is being shaped in front of our very eyes.
And it is Ukraine that happened to be on the cutting edge of clash of civilizations, at the forefront of protecting our common values, the struggle between good and evil.
Only by restoring Ukraine’s territorial integrity within its internationally recognized borders, we will revive the confidence in the rule of international law.
Only by ending Russian aggression, we will save the world from a Kremlin-grown virus of revanchism and neo-imperialism.
I want the world to know about it.
I want the world to hear that on the 1st of January, when everyone celebrated the fest of New Year, we lost a Ukrainian soldier – Mykola Golubev, who was killed by Russian aggressors shelling in Donbas.
In December 2018, he just turned 20.
His whole life was still ahead. But, it was taken by the Russian aggressor who broke into Ukrainian land.
I tell you about this because so is the present day in Ukraine.
This is what my every day is all about, as the President of Ukraine and as Commander-in-Chief, for already four and a half years.
This is what my heart bleeds about every given day, and this is what I would never be able to accept.
That is why I ask you on the following: when you inform your capitals, no matter how your governments vote for Ukraine-related resolutions in international organizations, please deliver truth about the undeclared war waged by Russia against Ukraine.
About Ukraine’s sacrifice as we defend peace in Europe.
About that the Kremlin does not plan to stop on Ukraine.
That in Ukraine Russia fine-tunes its new technologies of hybrid war. And it is only a matter of time where the Kremlin will use them tomorrow, the very next days.
Moscow understands well the strategic importance of Ukraine for the realization of its imperialistic fantasies.
The design is simple – that Ukraine will fall, that Ukraine will not stand.  
If Ukraine falls, it would only incite Russian appetites in other parts of Europe and in other parts of the world.
The methods of Russian aggression may change. The only thing remains unchanged – it lacks strive for peace.
For over four years, the Kremlin has refused implementing its obligations under the Minsk arrangements, which it signed itself.
The latest ceasefire – actually the 18th – has been violated yet again by the Russian side.
The Kremlin continues holding Ukrainian hostages in its prisons both in Russia and on the occupied Ukrainian territories.
Among them are the 24 Ukrainian sailors – prisoners of war. No mockery trial would help Russia hide its act of open aggression against Ukraine in the neutral waters of the Black sea.
Among them are Sakharov Prize laureate Oleg Sentsov, and Ukrainian patriot Volodymyr Baluch, who raised Ukraine’s flag over his house in the occupied Crimea.
Among them are the Crimean Tatars – sons and daughters of the people that suffers from a second genocide and a second deportation due to the Russian occupation.  
At the same time, the Kremlin understands that the Ukrainian army has become much stronger over last years.
It realizes that any attempt of further military invasion would end close to disastrous for aggressor.
Therefore, the Kremlin bets on undermining Ukraine from within.
The year 2019 will be decisive from this standpoint. The Kremlin has been preparing itself for it for long and at length.   
There is no secret about Moscow plans. The Russian leadership does not bother itself much with masking its intentions – to bring to office the authorities to be under its control as results of the presidential and parliamentary elections this year.
The aim is also quite clear – to stop democratic developments in Ukraine, its progress along the way of the European and the Euro-Atlantic integration, and to bring it back to the so-called “Russian sphere of influence”.
This is not just our take.
The Russian meddling to influence Ukraine’s elections is well under way. 
That said I would like to assure you that, as the President, I will do my utmost, first of all, to minimize the Russian influence on our elections.
And secondly – to create all conditions necessary for free and fair elections in Ukraine in line with the highest international standards. 
To that end, we have invited observers of reputable international organizations and countries to monitor the presidential elections.
 
Dear friends,
Not only the Kremlin was preparing itself for the year 2019.  
In Ukraine, we were preparing ourselves as well for this special year.
Despite the war ongoing, we launched and successfully implement the reforms – the most ambitious and most comprehensive ones in our history. 
We reached a significant progress, which was recognized by you, in modernizing our economy and infrastructure. 
We launched large-scale reforms in budget sphere, privatization, education, health care, pension system, decentralization and many others. 
We gave the first decisive fight to an epidemic corruption in Ukraine – we have set a reliable front of independent anti-corruption agencies, including the High Anti-corruption Court.  
We cleaned up a stall of corrupt practices in energy sector and in public procurement. 
We restrained inflation, reduced budget deficit and ensured sustainable macro financial stability. 
We have taken track of economic growth on a strong note. The digital economy has been launched. With confidence, we look forward to arrival of heavyweight foreign investors in Ukraine.    
There is no doubt that without support of our partners, especially of G7, it would be impossible to achieve all these in such a short period. 
I tender my sincere gratitude to you, in particular to the Presidency, for supporting Ukraine.
By standing by Ukraine, you have taken over a great responsibility – to help Ukraine escape from a former Soviet trap and now of “russkyi mir” and to turn our state into a land of freedom and prosperity. 
It is with confidence that we are going our own way. 
The way of building a democratic, based on the rule of law, European state, which is heading to EU and NATO membership consistently. 
This is the way of our national consensus, of our national idea. 
I am confident that we will not step back from this path any more.  
The deep and comprehensive free trade area with the EU is our guide for the full-fledged economic integration into the single European market.  
Ukraine successfully implements fundamental changes in security and defence sector. 
Ukrainian army already ranks among the top 10 of the most powerful armies of Europe. 
A recently adopted Law on National Security will be bringing us closer to the NATO standards at a faster pace. 
Moreover, our future membership in EU and NATO will be fixed in the Constitution.  
I believe that this my initiative will be supported shortly by the Ukrainian Parliament in the second reading. 
It will be our additional safeguard against any attempt of revanche.  
I would like to convey the words of my special gratitude to the United States – to our strategic partners. In Ukraine, we greatly value the transatlantic leadership of Washington as regards the countering of Russian aggression and supporting Ukraine.
It will not be an exaggeration to say that the decision to grant Ukraine with Javelins was historic one.
As deterrent, it considerably strengthened the security of our state.
It has also provided a long-awaited message to our partners.
Last year gave no chance to the Russian aggression to jump off the hook of sanctions, which, despite the Kremlin’s bravado, painfully hit at its ambitions and appetites.
Not only did they weaken the machinery of Russian aggression. They did give Ukraine a precious time to grow stronger – politically, economically, and militarily.
It was assisted by our close coordination with Berlin and Paris – reliable partners of Ukraine in the Normandy format.
The words of my most special gratitude go to Chancellor Angela Merkel.
It would be hard to overestimate what she has done to avoid catastrophic scenarios, both for Ukraine and Europe.
Unity and solidarity of the world behind Ukraine in response to Azov attack of Russia became like a cold shower for Moscow.
I am grateful to all those who supported us in this difficult moment. Especially to those states, which became co-sponsors and supported the two important resolutions of the UN General Assembly – on human rights in the Crimea and on militarization of the Crimea and parts of the Black and Azov Seas.
Your position has yet again confirmed that the Kremlin will pay a high price for its aggression.
The day will come when this price will go too heavy for the Kremlin.
Then we will return both the temporary occupied Crimea and the occupied part of Donbas.
It will definitely come true, which is confirmed by Ukraine’s way to the restoration of historic justice – establishment of autocephalous Orthodox Church of Ukraine. And almost all of you congratulated Ukrainian people with this great event.
Our road to Tomos was lengthy, uneasy and thorny. But we covered it with dignity.
Deeply and wholeheartedly I express my gratitude to all those involved in this difficult process – both from religious to secular authorities.
It is only with time that one would understand a historic scale of this event.
This is the second act of Ukraine’s independence, of our spiritual independence.
 
Your Excellencies,
The coming year will be decisive not only for Ukraine.
Unfortunately, a number of “hot spots” on the planet is growing.
It is not by coincidence that the major part of them is located inside or near Europe.
It is hard to miss the looming shadow of the same author of the chain of events, aimed at undermining the unity of the European Union.
It is crystal clear that this author is trying to relaunch the well-prepared in advance or to create new conflicts along the whole EU perimeter – starting from Ukraine and Moldova, Southern Caucasus, Western Balkans, Middle East, Africa up to directly some EU member states.
And this author is sitting in the Kremlin.
Therefore, it is of utmost importance for all of us to understand that and to stop considering all the current challenges as separate cases.
The world and its security are interlinked as never before.
That is why all what is going on in Ukraine today does matter for the countries, which are thousands miles away. And vice versa.
That is why by strengthening Ukraine’s resilience you, our partners, are investing in your own security, in your own peaceful future.
I believe that those, who are challenging the current world order, are powerless against our unity and solidarity.
They are our strength and guarantee of victory.
I would like to thank all of you for your very important support to Ukraine.
I am grateful that you share with us both the days of happiness and sorrow. Grateful that you are with us in times of successes and losses.
On my behalf, I wish all countries that you represent peace, welfare and prosperity.
And I want to finish with a new greeting in Ukraine.
Glory to Ukraine!"
4,"
President’s address on the occasion of granting the Tomos of autocephaly to the Orthodox Church of Ukraine
",https://www.president.gov.ua/en/news/promova-prezidenta-z-nagodi-vruchennya-tomosu-pro-avtokefali-52378,6 January 2019  - 11:11,"A great historic event, in which the Lord was with us, with Ukrainians, has just finished. And we, Ukrainians, were with the Lord. The Autocephalous Orthodox Church of Ukraine has finally received the Tomos from the Ecumenical Patriarch, from the Mother Church.
The Lord saw and commended the persistent struggle of the Ukrainian people for their independence. He heard our prayers. He gave us proper reparation for our work and facilitated that His All-Holiness Ecumenical Patriarch Bartholomew and the Synod of the Constantinople Mother Church said the long-awaited ""yes"" to the independent Church of Ukraine.
Today's event in the history of our country will remain in line with St. Vladimir’s baptism and the proclamation of Ukraine's independence. The Orthodox world will remember the day when the Church of Ukraine possessing equal rights joined the family of sister churches.
Our country has covered a long path to this day. And no wonder that yesterday His All-Holiness recalled in his speech Olga - our first Christian Princess and Equal of the Apostles Prince Vladimir-Baptist. And long before them, the holy Apostle Andrew stood on the mountains of Kyiv and ""his eyes saw Ukraine, and the mouth - blessed. And he planted the seed of faith in us"". This, by the way, is a quotation from the decisions of our Orthodox Council of 1621.
For over a thousand years, Kyiv's Christian tradition has been respected and multiplied. Today, our Orthodox Church is ready for independent existence. The Ukrainian people thank God and what has happened is a true miracle, which we owe to the Creator's will.
We rejoice that the Ecumenical Patriarch, as the spiritual leader of hundreds of millions of Orthodox people, as a global figure heard our voice and our requests. And the tireless work of His All-Holiness on the spiritual field will forever remain in the history of the church and in the history of nations, especially the Orthodox.
And the Tomos for us is actually another act of proclaiming Ukraine's independence. It will complete the assertion of the independence of the Ukrainian state, strengthen religious freedom, interconfessional peace. It will strengthen the rights and freedoms of citizens, especially those who were outside the communion with the Ecumenical Orthodoxy and who were unjustly called non-canonical.
His All-Holiness these days especially emphasizes the importance of restoring the communication of millions and millions of Ukrainian believers with the fullness of the world Orthodoxy. In addition, for Ukrainians, our own Church is a guarantee of our spiritual freedom. This is the key to social harmony.
And as President, I guarantee on behalf of the state that Ukraine will respect the religious choices and freedom of religion of every citizen.
I congratulate all those who care about the rise of the Autocephalous Orthodox Church of Ukraine. And I thank everyone who tirelessly worked on its emergence, created unity and restored justice!
St. Sophia, the wisdom of God was with us and we fulfilled our duty to the past and to the next generations.
Glory to God!
Glory to Ukraine!"
5,"
President’s New Year Address
",https://www.president.gov.ua/en/news/novorichne-privitannya-prezidenta-ukrayini-52350,31 December 2018  - 23:54,"Fellow Ukrainians!
A moment later and the chronicle of the year 2018 will be left in the archive of the Ukrainian history. It has a special place there. Near 1991, when our state independence was declared.
On December 15 here, on St. Sophia, the Unity Council was held. Thousands of people convened on the square and were not ashamed of tears. And those were tears of joy. At last, the Autocephalous Orthodox Church of Ukraine recognized by the world Orthodoxy was born.
The struggle for the independence of our church lasted for hundreds of years it is only now that we have succeeded.
This is a true miracle!
It is a sign of God that we, Ukrainians, will all be fine.
Shortly, along with the good news of the birth of the Savior, Ukraine will receive the long-awaited Tomos - a charter from the Ecumenical Patriarchate. It will document our spiritual independence.
We have become further from Moscow and closer to Europe. This is a clear strategy that has been steadfastly followed over the past five years. We go our own way. Neither promises of manna from heaven, nor grain of despondency, nor potion of discord - nothing should turn us back.
""The power of the people lies in the unity, God, give us the unity,"" - I would like these words to become the motto of the next year for the authorities, society and every citizen. Especially since the year 2019 is the 100th anniversary of the Zluky Act, the centennial of our unity.
We do not want anything more than peace. And no one wants peace more than we do. So, on behalf of you, let me congratulate, first of all, Ukrainian soldiers. They guarantee us peace and quiet on this New Year's Eve.
Let the seamen captured by Russians also feel our gratitude and the warmth of our hearts. And wounded among them - Andriy Eyder, Vasyl Soroka, Andriy Artemenko. And Ukrainian political prisoners in Russian prisons. And our citizens who became hostages in the temporarily occupied territories.
I appeal to millions of Ukrainians in Crimea and on the other side of Donbas. We will definitely return to you with peace, no matter how long it may take. Our family will surely reunite at one table, at which the New Year is met by Kyiv time.

Fellow Ukrainians!
The hardest thing has already passed, and the worst is also behind. The gradual growth of the economy and the restoration of living standards are ahead. This is the result of our common, hard work.
The main thing is not to trample the sprouts of development, gained at the cost of great sacrifices and enormous efforts of each of you, in the electoral race. Then we will surely win.

I wish you all happy New Year!
May our destiny stand with us!
Glory to Ukraine!"
