,headline,url,date,speech_text
6,"
Speech by the President on the results of the All-Ukrainian Orthodox Unity Council
",https://www.president.gov.ua/en/news/vistup-prezidenta-za-rezultatami-vseukrayinskogo-pravoslavno-52050,15 December 2018  - 18:15,"Glory to Ukraine!
I congratulate everyone on the creation of the Ukrainian Autocephalous Orthodox Church, which has just happened in St. Sophia!
Your Eminence!
Your Eminence - distinguished representatives of His All-Holiness Ecumenical Patriarch Bartholomew!
Your Holiness!
Your Beatitude!
Fellow Ukrainians!
Dear and distinguished community convened on St. Sophia’s Square, witnessing the most important lines of the chronicle of Ukraine!
Such a great event is happening today.
People say it is very cold in the streets. But each of you over several hours of tense expectation was warmed by your heart and thrill of anticipation of a great epochal event.
Dear friends, you are not witnesses. You are the creators of history, which is now happening. You are the direct participants of this great sacrament, which has just happened inside the St. Sophia’s Cathedral. The Cathedral that Yaroslav the Wise, the son of the Equal-to-apostles Prince Volodymyr the Baptist, built a thousand years ago in honor of the victory over the eastern horde. That is why your presence here, your mass support was extremely important for all the members of the Council. Frankly, I felt it, being among delegates at the invitation of His All-Holiness Patriarch Bartholomew.
So, it's done!
Today is December 15. I ask everyone who is watching us now: in Ukraine, all over the world - remember very well. This day will enter or has already entered the history of Ukraine as a sacred day, the day of the creation of the Autocephalous Orthodox Church of Ukraine. The day of the final gaining of Ukrainian independence from Russia. And Ukraine will no longer drink, as Taras Shevchenko said, ""Moscow’s poison from the Moscow’s bowl"".
This is the day of the creation of the Church recognized by the world Orthodoxy as an independent structure - just as in the vast majority of countries belonging to the Orthodox Christian tradition.
All representatives, the autocephalous council of the UOC-Kyivan Patriarchate, the cathedral and all the hierarchs of the UAOC, a group of bishops of the UOC-Moscow Patriarchate have just founded the united Church.
This miracle came true due to the steadfast position of His All-Holiness Ecumenical Patriarch Bartholomew, our Constantinople Mother Church. It took advantage of the unconditional canonical right to heal the wounds inflicted on the Ukrainian Orthodoxy by several centuries of Moscow’ domination.
Our talks were long-lasting. But over this year His All-Holiness and the Synod decided step by step to provide autocephaly. This is the first. Second, they approved the draft of the Tomos, certificate of independence. Third, they lifted all the unjust Moscow penalties from Ukrainian bishops, which got out of control of the Russian Orthodox Church at the dawn of independence and began to build structures of an independent church. And fourth, they confirmed the illegality of the annexation of the Kyivan Metropolitanate by Moscow, which was carried out in the XVII century. They, like us, do not recognize any claims of the ROC to Ukraine.
Therefore, as a result of the decisions of the Mother Church, the firm political will of secular authorities, the President, the Parliament, which supported the President's appeal, and most importantly of the Ukrainian people, due to the responsible position of the hierarchs of the three Orthodox jurisdictions today, a new united and independent Ukrainian Orthodox Church was born.
What is this church? This is a church without Putin. What is this church? This is a church without Kirill. What is this church? This is a church without prayer for the Russian authorities and Russian army. Because the Russian authorities and Russian army kill Ukrainians. But this is a church with God. This church is with Ukraine.
Yesterday, in social networks, I read a very interesting opinion: ""The church does not only sing and pray. The Church raises a true Ukrainian citizen"". And then I recalled the phrase traditionally attributed to Otto von Bismarck: ""Generals do not win the wars. The wars are won by school teachers and priests"". Of course, it should not be understood literally. It is about the unique role of the clergy and teachers in the formation of the nation and in the process of state building.
We are now creating an independent Ukraine. And this event is as important as the referendum on our independence adopted more than 27 years ago.
And what kind of citizen will be raised by the church center, if it is located in a foreign state, moreover, in the aggressor country? Exactly not a citizen of Ukraine. The Kremlin does not hide the fact that it considers the Russian Orthodox Church as one of the main instruments of influence on Ukraine. The situation in the Ukrainian Orthodoxy is discussed at the Russian Security Council under the chairmanship of its president. Instead, the Ukrainian state is required not to interfere in its own Ukrainian affairs!
And when Moscow speaks about Ukraine as allegedly its canonical territory, isn’t it an encroachment on our territorial integrity? And aren’t we obliged to protect Ukrainian soil and Ukrainian spirit in such conditions?
And we know well: in the areas where the Russian censer is being waved today, Russian missiles will strike tomorrow. At first, Patriarch Kirill toured Ukraine with the propaganda of the ""Russian peace"" and a single font, and then their tanks came! Obviously, the issue of autocephaly goes far beyond the church's fence. This is an issue of our national security. This is an issue of our statehood. This is an issue of the world politics. It is not a surprise that all the state leaders with whom I met over the past 6 months asked me: ""What about your church?"". We enjoy a huge and important support in this issue all over the world.
And when the Russian president said that the collapse of the USSR became for Russia the main geopolitical disaster of the XX century. ""For Putin,"" as Myroslav Marynovych wrote very well, ""The provision of autocephaly to Ukrainian Orthodoxy is the second geopolitical disaster"". But let me correct it, this time - the scale is not of the century, but of the millennium. Let them know that.
Fellow Ukrainians!
We have once again proved that nothing is impossible for us. A few years ago, many people said that it is impossible even if Poroshenko is involved, even if we do everything. Possible. There is nothing impossible for us. The main thing is to believe in the big purpose and not to retreat from it. Following this principle we have got the Association Agreement. Following this principle we have got the visa-free regime. Following this principle we are moving further towards the EU. And it is extremely important for us that all the victories will be with Ukraine. I want to emphasize separately that today we have a great day. We will not retreat from the path we are following starting from 2014.
Today is a common holiday of the Orthodox, Greek Catholics, Roman Catholics, Protestants, Jews, Muslims. In short, for all who value the freedom of Ukraine. Who value our independence. No patriot doubts the importance of having an independent Orthodox church in an independent Ukrainian state. Such a church is a spiritual guarantor of our sovereignty. In December 1991, at the referendum, we approved the Declaration of Independence. In December 2018, an independent Orthodox Ukrainian Church was founded, to which the Ecumenical Patriarch will hand over the Tomos.
Autocephaly is part of our state pro-European and pro-Ukrainian strategy, which we have been consistently implementing for almost five years. All this is the basis of our own way of development, development of the state of Ukraine and development of our Ukrainian nation.
""Russian comrade, don't mess with Ukraine!"" - I quoted Mayakovsky in August 2016 at the parade on the 25th anniversary of Independence. And our Armed Forces are getting stronger every day. And it's not a joke!
“Farewell, unwashed Russia” - I said on the European Square when we gained the visa-free regime, I quoted Lermontov. Farewell indeed!
“Farewell to you, our tender Misha, go back home to your wood of fairy tales” - these words were addressed to Moscow in autumn this year. Farewell indeed!
“Away from Moscow! Europe now!”. Now these winged phrases of the Ukrainian writer of the beginning of the last century Mykola Khvylovy became part of our political dictionary. And they precisely convey the essence of our state strategy, our confident course towards the European Union and NATO.
Fellow community!
Allow me from all of our community, from the entire Ukraine and the Ukrainian people to express gratitude to Ecumenical Patriarch Bartholomew for his incredible care for Ukraine.
I want to thank all Ukrainians who believed in the autocephaly from the outset, who supported the President, the Chairman of the Verkhovna Rada, the Parliament, supported our hierarchs and fought for the autocephaly even when the very idea seemed illusory.
First of all, I also want to thank our hierarchs and leaders of our Orthodox churches. His Holiness Filaret. Your Holiness, do you hear this reaction of people on the square? ... Your Holiness, the extent, which can measure the contribution of Patriarch Filaret to the struggle for our own Autocephalous Church has not been invented yet. You were, are and remain the spiritual leader of the Ukrainian church, the spiritual leader of the Ukrainian people.
I want to thank Primate of the UAOC Metropolitan Macarius and the whole episcopate for a firm position and an extraordinary role in this historical process.
I want to thank the hierarchs of the UOC-Moscow Patriarchate, who, despite the pressure, threats and curses of Moscow and its fifth column, made a courageous decision and came to the Council today. Everything is very simple - they chose Ukraine between Ukraine and Russia. And we commend this choice.
We did not have, do not have and will not have a state church. The state will not interfere in church affairs. And nobody will ""invite"" anyone by force to the Orthodox Church consecrated by the Tomos. Once again, I emphasize that this is an issue of free choice for each believer. I guarantee that the authorities will respect the choice of those who, under certain circumstances, decide to remain in the church structure, which will maintain unity with the ROC. But I also guarantee that the state will protect the rights of the priests and believers of the UOC-Moscow Patriarchate, who voluntarily decide to leave Moscow in order to create, together with other Orthodox, the Ukrainian Autocephalous Orthodox Church.
Such Church has been founded today. It needs some time for its development, peaceful expansion and strengthening. Let me now introduce you the newly elected Primate, Metropolitan of Kyiv and All Ukraine Epifaniy. It will be his honorable mission to go to Constantinople with the Ukrainian President in early January and get the long-awaited Tomos. Bishop Epifaniy, representative of the younger generation of bishops, was nominated by the UOC-Kyivan Patriarchate and supported by the representatives of other churches. But now there is no such division. That division does not matter anymore, because a united church is being created.
The power of our people is in unity. God, give us the unity! There is such a prayer and it is very relevant to today's events.
Unity is what will give us victory.
Fellow Ukrainians!
I sincerely congratulate you on the autocephaly and the achievement of our spiritual independence.
We have stopped the aggressor. We have saved the state. We have built a capable army. We affirm the Ukrainian language as a component of the strength and success of our people.
Over this year, we have become even more convinced that the Autocephalous Church is the key to independence. The state language is the key to unity. A strong army is the key to peace.
We will certainly win!
Glory to God and Glory to Ukraine!
And now, with pleasure, I give the floor to the Primate of the united Church, Metropolitan of Kyiv and All Ukraine Epifaniy. Please, Bishop!"
7,"
Statement by the President of Ukraine on the approval of the Decree on the introduction of martial law in Ukraine
",https://www.president.gov.ua/en/news/zayava-prezidenta-ukrayini-shodo-zatverdzhennya-ukazu-pro-vv-51362,26 November 2018  - 17:33,"Fellow Ukrainians!
Today, the Parliament will consider the issue of extreme importance, which directly concerns your protection, your security, the security of Ukraine, its sovereignty and territorial integrity.
According to the decision of the National Security and Defense Council of Ukraine adopted tonight, as President and as Supreme Commander-in-Chief of the Armed Forces of Ukraine, I have fulfilled my constitutional duty and a few hours ago, by my decree, I introduced martial law all over Ukraine starting from 9 am, November 28 .
Russia has been waging a hybrid war against our country for five years. But with an attack on Ukrainian military boats it moved to a new stage of aggression. No one will say now: ""They are not there"". No one camouflages into green humanoids or militiamen. This is a bold and frank participation of the regular units of the Russian Federation, their demonstrative attack on the detachment of the Ukrainian Armed Forces. This is a qualitatively different situation, a qualitatively different threat.
And this attack, of course, is not accidental. This is clearly an element planned by Russians in the escalation of the situation in the waters of the Sea of Azov, which has been lasting for several months. And I'm sure this is still not a culmination.
Security officials and diplomats have informed you today at a press conference about all the circumstances of yesterday's incident.
Reconnaissance data suggest an extremely serious threat of a land-based operation against Ukraine. I have a document of intelligence in my hands, a summary of our intelligence data. Here on several pages is a detailed description of all the forces of the enemy located at a distance of literally several dozens of kilometers from our border. Ready at any moment for an immediate invasion of Ukraine. A rifle hanging on the wall will go off sooner or later. And these are planes, helicopters, tanks, missile complexes, armored personnel carriers, salvo fire systems.
Of all the options provided by the Law ""On the Legal Status of Martial Law"", the Decree, my Decree ""On the Imposition of Martial Law"" includes only those that deal mainly with various military activities - we must strengthen the security right now. (Measures - ed.) that in case of the invasion will allow us to react as quickly as possible, mobilize all resources as soon as possible. Especially since the boys and girls from the first wave of the reserve, which already have military experience, are ready to pack rucksacks right now and resources will be mobilized - both human, arms and financial.
I emphasize that I do not envisage any measures in the Decree related to the restriction of the rights and freedoms of citizens, introduction of censorship, etc. I hope that both politicians and mass media will act responsibly and adequately in the current situation and will not attack Ukraine with the theses borrowed from Russian propagandists.
Nor do I plan to resort to full or partial mobilization so far - this opportunity remains open only if Russia resorts to further escalation.
Martial law does not mean the declaration of war. It is introduced solely for the purpose of strengthening Ukraine's defense against the background of growing aggressiveness from Russia. Martial law does not mean our retreat from the political-diplomatic settlement in the east. Today, I informed our western partners about this in detail. From the very morning, I have had detailed talks with NATO Secretary General Jens Stoltenberg, with Polish President Andrzej Duda, since Poland represents Ukraine’s position and is the initiator of the consideration of the situation at the UN Security Council, with German Chancellor Angela Merkel and with many others. Consultations will be continued this evening. And I can tell you that their attention to the situation in the east and directly in the waters of the Sea of ​​Azov has increased substantially. Today, we are heard much better than yesterday or the day before yesterday.
Dear friends, fellow Ukrainians.
Our joint responsibility, first of all mine, as of Supreme Commander-in-Chief, is to protect Ukraine. And Ukraine's defense is not only the defense of territory or military equipment. This is primarily the protection of people. We must be as prepared as possible for any action by our aggressive, volatile and, unfortunately, pretty unpredictable neighbor.
Of course, it is related to the protection of the right to free choice as well. Only a reliable defense, only doubling and tripling our defensive efforts guarantees peace that is needed, inter alia, for the conduct of the elections.
The NSDC recommended me today to introduce martial law for 60 days. I want to announce to you my decision - I will propose to the Parliament to introduce martial law for 30 days. For what? For martial law not to overlap with the beginning of the election campaign by a single day. So that no one of those who care for their party, their political interest more than for the nation and Ukrainian interest have a reason for dirty political speculations or insinuations.
Martial law will last 30 days and will end in mid-December. It is in December, in early December, that I will submit a draft resolution to the Parliament on the date of the presidential elections to be held in accordance with the Constitution on March 31, 2019. Period. As Supreme Commander-in-Chief, I will make every effort to stay within this short term and squeeze out the maximum opportunities from this month to increase our readiness to repel a possible full-scale offensive of the aggressor country - Russia.
Glory to Ukraine!"
